{
  "contract": {
    "authorityEffect": "derived-non-authoritative",
    "canonical": false,
    "limits": [
      "no-network",
      "no-credentials",
      "no-runtime-effects",
      "no-canonical-write",
      "no-approval",
      "no-scheduling"
    ],
    "projectionId": "intake-registry-exocore-public-projection",
    "sourceDigest": "787885c84ada570179e94d0ba2989457be76736f3e35b0a61c11c783606bb872",
    "sourceIdentity": "hcc-intake-form-grammar-v0.2",
    "syntheticOnly": true,
    "version": "0.2.0-candidate.1"
  },
  "definitions": [
    {
      "authorityEffect": "candidate-definition-no-runtime-authority",
      "compatibleFacetRefs": [
        "queue-state",
        "domain",
        "projection-kind"
      ],
      "compatibleProfileRefs": [
        "private-learning-research",
        "software-development-and-architecture"
      ],
      "coreRef": "external-content",
      "definition": "What external material is being offered for review, under which locator and rights basis?",
      "definitionId": "hcc-intake-external-content-representative",
      "eligibleFormRefs": [
        "external-content-capture"
      ],
      "exclusionRules": [
        "Do not select this type solely from a filename, channel, domain, or renderer.",
        "Do not use it to infer human intent, private state, or authority.",
        "Do not treat candidate capture as acceptance, publication, execution, or verification."
      ],
      "inclusionRules": [
        "The primary intake act matches external-content.",
        "The evidence can satisfy this definition without borrowing authority from another core.",
        "The human can distinguish this act from the listed exclusions."
      ],
      "intentQuestion": "What external material is being offered for review, under which locator and rights basis?",
      "overlapResolution": "Use the core matching the human intake act; record secondary cores only with explicit rationale and never substitute a profile or facet for a core.",
      "proofBoundary": "Proves only that a bounded source candidate was submitted with origin and rights context; it does not prove source truth, permission, or acceptance.",
      "publicationDefault": "not-proposed",
      "requiredEvidence": [
        "a resolvable or explicitly opaque source locator",
        "a capture scope or bounded excerpt",
        "a rights basis or explicit unknown state"
      ],
      "title": "Bounded external source submission",
      "version": "0.2.0-candidate.1"
    },
    {
      "authorityEffect": "candidate-definition-no-runtime-authority",
      "compatibleFacetRefs": [
        "domain",
        "domain-business-research"
      ],
      "compatibleProfileRefs": [
        "private-learning-research",
        "restricted-opt-in-self-report",
        "software-development-and-architecture"
      ],
      "coreRef": "ideas-reflections",
      "definition": "What idea, reflection, hypothesis, or proposal is the human choosing to preserve?",
      "definitionId": "hcc-intake-ideas-reflections-representative",
      "eligibleFormRefs": [
        "idea-reflection-capture"
      ],
      "exclusionRules": [
        "Do not select this type solely from a filename, channel, domain, or renderer.",
        "Do not use it to infer human intent, private state, or authority.",
        "Do not treat candidate capture as acceptance, publication, execution, or verification."
      ],
      "inclusionRules": [
        "The primary intake act matches ideas-reflections.",
        "The evidence can satisfy this definition without borrowing authority from another core.",
        "The human can distinguish this act from the listed exclusions."
      ],
      "intentQuestion": "What idea, reflection, hypothesis, or proposal is the human choosing to preserve?",
      "overlapResolution": "Use the core matching the human intake act; record secondary cores only with explicit rationale and never substitute a profile or facet for a core.",
      "proofBoundary": "Proves only authored capture and stated context; it does not prove diagnosis, correctness, feasibility, or public authorship release.",
      "publicationDefault": "not-proposed",
      "requiredEvidence": [
        "human-authored body or bounded summary",
        "an explicit authorship marker",
        "a privacy tier"
      ],
      "title": "Authored idea or reflection",
      "version": "0.2.0-candidate.1"
    },
    {
      "authorityEffect": "candidate-definition-no-runtime-authority",
      "compatibleFacetRefs": [
        "queue-state",
        "domain",
        "projection-kind"
      ],
      "compatibleProfileRefs": [
        "private-learning-research",
        "software-development-and-architecture"
      ],
      "coreRef": "knowledge-learning-research",
      "definition": "What source-linked learning or research input should remain available for inquiry?",
      "definitionId": "hcc-intake-knowledge-learning-research-representative",
      "eligibleFormRefs": [
        "external-content-capture"
      ],
      "exclusionRules": [
        "Do not select this type solely from a filename, channel, domain, or renderer.",
        "Do not use it to infer human intent, private state, or authority.",
        "Do not treat candidate capture as acceptance, publication, execution, or verification."
      ],
      "inclusionRules": [
        "The primary intake act matches knowledge-learning-research.",
        "The evidence can satisfy this definition without borrowing authority from another core.",
        "The human can distinguish this act from the listed exclusions."
      ],
      "intentQuestion": "What source-linked learning or research input should remain available for inquiry?",
      "overlapResolution": "Use the core matching the human intake act; record secondary cores only with explicit rationale and never substitute a profile or facet for a core.",
      "proofBoundary": "Proves only that an input is available for bounded inquiry; it does not prove a claim, methodology, or research conclusion.",
      "publicationDefault": "not-proposed",
      "requiredEvidence": [
        "source locator or experiment reference",
        "a bounded research or learning question",
        "provenance and uncertainty notes"
      ],
      "title": "Knowledge, learning, or research input",
      "version": "0.2.0-candidate.1"
    },
    {
      "authorityEffect": "candidate-definition-no-runtime-authority",
      "compatibleFacetRefs": [
        "queue-state",
        "domain",
        "domain-business-research",
        "projection-kind"
      ],
      "compatibleProfileRefs": [
        "private-learning-research",
        "restricted-opt-in-self-report",
        "software-development-and-architecture"
      ],
      "coreRef": "ai-assisted-insights",
      "definition": "What AI-assisted candidate is worth reviewing, and which source material and uncertainty must remain attached?",
      "definitionId": "hcc-intake-ai-assisted-insights-representative",
      "eligibleFormRefs": [
        "external-content-capture",
        "idea-reflection-capture"
      ],
      "exclusionRules": [
        "Do not select this type solely from a filename, channel, domain, or renderer.",
        "Do not use it to infer human intent, private state, or authority.",
        "Do not treat candidate capture as acceptance, publication, execution, or verification."
      ],
      "inclusionRules": [
        "The primary intake act matches ai-assisted-insights.",
        "The evidence can satisfy this definition without borrowing authority from another core.",
        "The human can distinguish this act from the listed exclusions."
      ],
      "intentQuestion": "What AI-assisted candidate is worth reviewing, and which source material and uncertainty must remain attached?",
      "overlapResolution": "Use the core matching the human intake act; record secondary cores only with explicit rationale and never substitute a profile or facet for a core.",
      "proofBoundary": "Proves only preservation of an AI-assisted candidate with provenance; it does not transfer human authorship or establish factual validity.",
      "publicationDefault": "not-proposed",
      "requiredEvidence": [
        "model or agent provenance",
        "source references or explicit source absence",
        "an uncertainty statement"
      ],
      "title": "AI-assisted candidate insight",
      "version": "0.2.0-candidate.1"
    },
    {
      "authorityEffect": "candidate-definition-no-runtime-authority",
      "compatibleFacetRefs": [
        "domain",
        "response-act"
      ],
      "compatibleProfileRefs": [
        "private-learning-research",
        "software-development-and-architecture"
      ],
      "coreRef": "decisions",
      "definition": "What choice did the authorized human make, within which scope and alternatives?",
      "definitionId": "hcc-intake-decisions-representative",
      "eligibleFormRefs": [
        "decision-record",
        "review-response"
      ],
      "exclusionRules": [
        "Do not select this type solely from a filename, channel, domain, or renderer.",
        "Do not use it to infer human intent, private state, or authority.",
        "Do not treat candidate capture as acceptance, publication, execution, or verification."
      ],
      "inclusionRules": [
        "The primary intake act matches decisions.",
        "The evidence can satisfy this definition without borrowing authority from another core.",
        "The human can distinguish this act from the listed exclusions."
      ],
      "intentQuestion": "What choice did the authorized human make, within which scope and alternatives?",
      "overlapResolution": "Use the core matching the human intake act; record secondary cores only with explicit rationale and never substitute a profile or facet for a core.",